{"commit_sha":"225733dd8965928cc8770acba7368102de70056b","contract_version":"growth.critic_export.v1","critic_mode":"structural_rule","dimension_observations":{"audio_balance":{"rule_observation":{"available":true,"confidence":0.75,"evidence":["audio_probe:true_peak_dbfs","audio_probe:voice_lufs","audio_probe:music_lufs"],"human_ground_truth":false,"limitation":null,"normalized_score":0.64},"source_dimension":"audio_voice_music_balance","unavailable":null,"vlm_observations":[]},"broll_relevance":{"rule_observation":{"available":true,"confidence":0.61,"evidence":["sampled_frames:broll_semantic_match"],"human_ground_truth":false,"limitation":null,"normalized_score":0.47},"source_dimension":"broll_relevance","unavailable":null,"vlm_observations":[]},"captions":{"rule_observation":{"available":true,"confidence":0.6,"evidence":["captions:reading_speed","captions:contrast","captions:collision","captions:emphasis"],"human_ground_truth":false,"limitation":null,"normalized_score":0.761333},"source_dimension":"caption_readability_emphasis_relevance","unavailable":null,"vlm_observations":[]},"continuity":{"rule_observation":{"available":true,"confidence":0.64,"evidence":["sampled_frames:continuity_break"],"human_ground_truth":false,"limitation":null,"normalized_score":0.625},"source_dimension":"visual_continuity","unavailable":null,"vlm_observations":[]},"framing_crop":{"rule_observation":{"available":true,"confidence":0.75,"evidence":["sampled_frames:subject_bbox"],"human_ground_truth":false,"limitation":null,"normalized_score":0.824134},"source_dimension":"subject_framing_crop_quality","unavailable":null,"vlm_observations":[]},"hook":{"rule_observation":{"available":true,"confidence":0.59,"evidence":["sampled_frames:first_3s","captions:first_3s"],"human_ground_truth":false,"limitation":null,"normalized_score":0.3758},"source_dimension":"hook_clarity_first_1_3s","unavailable":null,"vlm_observations":[]},"motion_appropriateness":{"rule_observation":{"available":true,"confidence":0.64,"evidence":["sampled_frames:motion_score","sampled_frames:zoom_factor"],"human_ground_truth":false,"limitation":null,"normalized_score":0.875},"source_dimension":"motion_zoom_appropriateness","unavailable":null,"vlm_observations":[]},"pacing":{"rule_observation":{"available":true,"confidence":0.72,"evidence":["sampled_frames:shot_ids"],"human_ground_truth":false,"limitation":null,"normalized_score":0.833333},"source_dimension":"pacing_coherence","unavailable":null,"vlm_observations":[]},"payoff_cta_loop":{"rule_observation":{"available":true,"confidence":0.59,"evidence":["source_semantic_timeline:end","captions:end"],"human_ground_truth":false,"limitation":null,"normalized_score":1.0},"source_dimension":"payoff_cta_loop_coherence","unavailable":null,"vlm_observations":[]},"semantic_cut_correctness":{"rule_observation":{"available":true,"confidence":0.66,"evidence":["cuts:semantic_safe"],"human_ground_truth":false,"limitation":null,"normalized_score":0.666667},"source_dimension":"semantic_cut_correctness","unavailable":null,"vlm_observations":[]}},"hard_failure_observations":[{"code":"CAPTION_COLLISION","human_ground_truth":false,"message":"caption collision reported by source timeline","source":"caption_timeline","time_ms":8700}],"human_ground_truth":false,"model_or_rule_identity":{"contract_version":"growth.visual_critic.r15.v1","kind":"rule","mode":"deterministic_structural","model":null,"provider":null},"pairwise_if_used":null,"render_sha256":"9c581130f054417b3ccd82409df6b9b069221c3f27dc8cb09e707474d4a64103","repository":"foto6/video3","source_id":"benchmark-source-bad","timecoded_evidence":[{"end_ms":0,"evidence_kind":"structural_heuristic","human_ground_truth":false,"note":"First 1-3s has weak subject/caption structural clarity.","rubric_dimension":"hook","severity":"warning","source_dimension":"hook_clarity_first_1_3s","start_ms":0},{"end_ms":200,"evidence_kind":"structural_heuristic","human_ground_truth":false,"note":"Caption reading speed is high for short-form viewing.","rubric_dimension":"captions","severity":"warning","source_dimension":"caption_readability_emphasis_relevance","start_ms":200},{"end_ms":7000,"evidence_kind":"structural_heuristic","human_ground_truth":false,"note":"Cut is marked semantically unsafe against source timing.","rubric_dimension":"semantic_cut_correctness","severity":"warning","source_dimension":"semantic_cut_correctness","start_ms":7000},{"end_ms":7200,"evidence_kind":"structural_heuristic","human_ground_truth":false,"note":"Subject framing/crop is structurally off-center or poorly sized.","rubric_dimension":"framing_crop","severity":"warning","source_dimension":"subject_framing_crop_quality","start_ms":7200},{"end_ms":7200,"evidence_kind":"structural_heuristic","human_ground_truth":false,"note":"Sample is marked as a visual continuity break.","rubric_dimension":"continuity","severity":"warning","source_dimension":"visual_continuity","start_ms":7200},{"end_ms":8700,"evidence_kind":"objective_hard_failure","human_ground_truth":false,"note":"Caption collision overlaps another protected region.","rubric_dimension":"captions","severity":"hard_failure","source_dimension":"caption_readability_emphasis_relevance","start_ms":8700},{"end_ms":10700,"evidence_kind":"structural_heuristic","human_ground_truth":false,"note":"Extended silence plus low motion indicates an awkward/dead moment.","rubric_dimension":null,"severity":"warning","source_dimension":"awkward_dead_moments","start_ms":10700},{"end_ms":11000,"evidence_kind":"structural_heuristic","human_ground_truth":false,"note":"B-roll has low semantic match to supplied source context.","rubric_dimension":"broll_relevance","severity":"warning","source_dimension":"broll_relevance","start_ms":11000},{"end_ms":11000,"evidence_kind":"structural_heuristic","human_ground_truth":false,"note":"Motion/zoom intensity is structurally extreme.","rubric_dimension":"motion_appropriateness","severity":"warning","source_dimension":"motion_zoom_appropriateness","start_ms":11000},{"end_ms":null,"evidence_kind":"structural_heuristic","human_ground_truth":false,"note":"Music level is close to or above voice level.","rubric_dimension":"audio_balance","severity":"warning","source_dimension":"audio_voice_music_balance","start_ms":null}]}
